Category,Data Text,Tool name
Project Management,"What is ClickUp? ClickUp is an all-in-one productivity platform that works as an ideal place for teams to come together, brainstorm, plan, and collaborate on everything from process docs to product designs. While relying on a single tool for so many use cases might sound like a stretch—ClickUp was built for this.
ClickUp was founded on the mission of saving the world more time and has consistently stayed on the cutting edge of productivity ever since. Its rich work management features are completely customizable, and with the launch of its own AI tool, there’s very little ClickUp can’t do.
From campaign planning to agile workflows, there are endless ways to make your Workspace your own. The beauty of it lies in ClickUp’s ability to align with the needs of virtually any project methodology, department, or industry and scale with you as your business grows. Visualize your tasks with over 15 views in ClickUp including List, Board, and Calendar
Collaboration is at the core of every feature, making it possible to connect with peers from anywhere in the platform for peak efficiency—whether you’re working with five or 500 other members. Plus, you don’t need to enter the platform with a clear strategy already in mind to make the most of ClickUp’s capabilities. Through online courses, an extensive Help Center, webinars, and more, ClickUp is ready to support you at any phase in your productivity journey.
Not to mention, its extensive Template Library has something for everyone in your organization. With thousands of pre-built frameworks to kickstart your processes, you’ll never have to start from square one again. ✅
Choose from the many pre-built templates created by ClickUp to kickstart any process
ClickUp also integrates with more than 1,000 other work tools to centralize data across your tech stack into a single secure Workspace. This, combined with its built-in document editor, whiteboard software, flexible goal-tracking, in-app chat, and more, helps ClickUp streamline any process while eliminating the need to open yet another tab.
How Top Teams Are Using ClickUp
From planning your kitchen remodel to onboarding an entire company, we wholeheartedly believe that everyone could benefit from a little more ClickUp in their lives. That said, some teams naturally take ClickUp’s features, functionality, and flexibility to the next level. As we dive into the specifics of how teams across disciplines make the most of their Workspaces, bear in mind that we’re still only scratching the surface. ClickUp’s complete customization capabilities allow teams to tailor their platform in truly infinite ways. And if the following use case examples inspire new ways for your own team to stay lean and increase productivity—good! This article is just the beginning.
Follow along for details on how software, service, marketing, and project management teams find success with ClickUp. How software development teams use ClickUp
ClickUp is a lifesaver for software teams looking for a flexible solution to solidify their strategies, simplify the development lifecycle, and support cross-functional teamwork.
These teams juggle the needs of product managers, engineers, and designers daily—all while toggling between multiple apps to meet deadlines before the next sprint meeting. They need a feature-rich software solution to unify their tech stack and team members alike, with the ability to access Kanban boards, real-time analytics, roadmaps, issue tracking, and more.
Basically, all of the functionality that ClickUp is best known for.
Work Breakdown Structure Example in Board view in ClickUp
There are over 15 customizable ways to visualize your workload from every angle including List, Gantt, Timeline, and Kanban-like Board view. For a bird’s eye view of your overall progress, Agile Dashboards in ClickUp can surface deeper insight into your projects in real-time. Dashboards in ClickUp are completely customizable, allowing teams to hone in on the metrics and KPIs that are most critical to their success. From burnup and burndown charts to lead and cycle time tracking, there are more than 100 ways to keep your finger on the pulse of your projects in Dashboards.
Another excellent use case for Dashboards?
Tracking issues and bugs promptly. With features like drill-down on Line, Bar, Pie, and Battery chart cards, you can click into your data to identify specific tasks and fast answers. Dig into the granular details of your data with drill-down capabilities in Dashboards
To keep all of your bug reports together, Forms in ClickUp are a must. Share a link to your survey with customers, capture their responses, and automatically turn their requests into actionable tasks for immediate resolution. While visibility and real-time reporting are key to software teams’ success, they’re not the only priorities on their plate. Product roadmapping capabilities, workflow Automations, and multiple integrations also play significant roles in the team’s day-to-day.
Using ClickUp Whiteboards, teams can collaborate to build product roadmaps from scratch or with the help of a ready-made template to expedite the process and cut to the work faster. We suggest starting with the Product Roadmap Whiteboard Template in ClickUp. Ready to learn more about how ClickUp helps software teams improve visibility, stay agile, and align on strategy? Read how Talent Plus increased team capacity by 10% with ClickUp. How marketing teams use ClickUp
ClickUp’s built-in goals feature, document editor, collaboration tools, and ease of use also make it an essential part of various marketing activities. Its highly visual features benefit both the creative and data-driven aspects of a solid marketing strategy, bringing your ideas to life even faster, from one central campaign hub.
Use ClickUp’s Goal Tracking feature to stay on track to hit your goals with clear timelines, measurable targets, and automated progress tracking
When you’re ready to set your ideas in motion, ClickUp then becomes the ultimate resource for effective campaign management and tracking. Beyond the high-level insights from your Dashboards, ClickUp makes it easy to stay on top of your marketing OKRs with an in-app Goals feature connected to key tasks or larger objectives.
At the task level, ClickUp supports daily campaign management efforts with multiple ways to connect with your team, stakeholders, clients, vendors, and more. With threaded comments to keep conversations together and @mentions to delegate action items, it’s easy to conduct check-ins, share updates, and collaborate within any task. While your demand generation and performance marketing teams may spend the bulk of their time on tasks, your content marketing team will be heads-down in ClickUp Docs or Calendar view to keep up with editorial strategies. Plus, your marketing team will rave about ClickUp’s latest revolutionary productivity feature—ClickUp AI. ClickUp AI can generate endless document types like project briefs, lesson plans, and other documents to speed up your workflow
ClickUp AI is the only role-based AI-powered software with research-backed prompts designed specifically for your exact use case. Instantly summarize tasks, comment threads, and lengthy documents, or generate net-new tasks and tailored copy in seconds. Still, there is so much more that ClickUp can do for marketing teams like Finastra. By going all-in on ClickUp, Finastra consolidated and scaled its marketing efforts to significantly increase its efficiency and effectiveness across the board. How service-based businesses use ClickUp
Service-based businesses and agencies need a flexible tool with a feature list as diverse as the services they offer. Lucky, ClickUp fits the bill (and then some). One of the greatest pain points these teams face is simply staying connected. Not just to the team, but to clients and other stakeholders as well. Due to growing pressure to reduce project durations without sacrificing quality, full-service agencies are always in search of solutions to simplify their client processes from intake through closing. Managing customers, sales pipelines, action items, and more with the Simple CRM Template by ClickUp in List view
Bonus: Learn how Hawke Media decreased project delays and created company-wide visibility with ClickUp. This is another instance where ClickUp Forms come in handy. By routing all Form responses to designated a new client List or CRM, agencies can start streamlining the new client onboarding experience from first contact. From there, it’s easy to keep all key players in the loop with custom permissions and Workspace guests in ClickUp. Collaborative Whiteboards in ClickUp make brainstorming concepts, solidifying your project scope, and defining resources more efficient—and dare we say, fun. By embedding media, ClickUp Docs, live websites, and action items to your board, it quickly becomes the creative epicenter for the latest client updates and your team’s best new ideas.
Best of all, Whiteboards in ClickUp are the only digital whiteboard software with the power to convert any object directly into an actionable ClickUp task. Meaning you can act on your creativity the moment it strikes you. 🎨
Embed live ClickUp Docs directly into Whiteboards to access important project documents, research, and context without ever leaving your board
To keep clients involved throughout the development process, client Folders, Lists, and views can be made private and shared only with the necessary members. This allows specific players to participate in task comments, access project updates, and suggest edits as review cycles approach.
Bringing your clients into the platform where their project lives promotes transparency throughout the project process and gives your client the piece of mind that the final product will be delivered on time. As for internal needs, native time tracking and billable hours in ClickUp ensure creatives are accurately compensated for their work. To avoid burnout, ClickUp’s unique Workload view helps team leads manage their team’s capacity and evenly delegate tasks. Find the cost of entire campaigns, billable hours, and more with advanced formulas in ClickUp Custom Fields
How PMO and operations teams use ClickUp
Project management is ClickUp’s bread and butter—it’s also a common throughline between virtually every team, regardless of size or industry. Take your time management a step further with ClickUp’s Workload view and see how your estimated time per task measures up against the total time in your week.
Often found spearheading your IT and operation departments, PMO leaders are tasked with the challenge of continuously driving efficiency throughout the entire organization. They’ll use every feature discussed in this article including: •	Dashboards to grasp processes at a glance and compare how work is progressing against the allotted resources
•	Docs to collaborate alongside the team on project launch strategies and capture process documentation in an accessible knowledge base
•	Whiteboards to break down complex workflows and improve processes
•	Goals to set, hit, and celebrate wins of all kinds
And many, many others. For PMO and operations teams, project views and tasks are the glue holding it all together.
Customizable views in ClickUp help teams arrange entire projects in a dynamic List, Table, Mind Map, Board, or Timeline. These views can be narrowly tailored down to the most precise detail with filters and grouping to mirror any process.
Views can also be adapted to suit the work preferences of each team member for a more inclusive work experience across the team. For the most accurate read on your overall status, all tasks, Lists, and priorities must be updated daily. This alone takes a lot of oversight, especially for more complex projects. In these situations, custom task statuses go a long way.
Within a matter of clicks, Members can visually convey where they are with specific action items and watch those updates immediately reflect in their Dashboards in real time. Just as there are an infinite number of ways to customize your Workspace, there are endless use cases for ClickUp.
These four use cases are a drop in the bucket compared to the ever-growing number of teams revolutionizing their workflows and saving time by using ClickUp.",ClickUp
Project Management,"Teams Choose ClickUp: 12 Reasons Why
1. Multiple Views
ClickUp has not one, not two, but 15+ different views for you to choose from!
We know managing projects, timelines, and people are already challenging as it is, so the way you view your work shouldn’t add more unnecessary stress to your work life. Not to mention, everyone has different work and learning styles; there should be options to accommodate them all!
With ClickUp, you’ll get to view your work, your way. Here are your options:
1.	List view: it’s the most flexible view in terms of grouping, sorting, and filtering. Get a high-level overview of all tasks across your ClickUp Workspace
2.	Board view: create the perfect Agile workflow, group your Boards your way, and see all your Boards in one view
3.	Box view: gives you insight into what people are working on, what they’ve done, and who needs more or fewer tasks
4.	Calendar view: organize projects, plan timelines, and visualize your team’s work on a flexible calendar that keeps everyone on the same page
5.	Gantt view: a powerful, analytical tool that offers you a birds-eye view of your entire project. Schedule tasks, manage deadlines, and handle bottlenecks in this view
6.	Mind Map view: plan and organize projects, ideas, or existing tasks in ClickUp for the ultimate visual outline
7.	Timeline view: gives you a quick visual overview of parameters like task names, task assignees, task duration, and task dependencies
8.	Workload view: allows you to visualize your team’s capacity and manage resources
9.	Table view: create lightning-fast spreadsheets and powerful visual databases to manage budgets, inventories, client information, and more
10.	Activity view: get an aggregated view of all activity across that location. Filter for people and type to get granular with the activity you see
11.	Map view: coupled with the Location Custom Field, clearly see where your tasks, destinations, or any relevant location falls on a map
12.	Doc view: create beautiful Docs, wikis, knowledge bases, and more with Doc’s views flexible and sharable pages
13.	Chat view: quickly share updates, link resources, and consolidate team communication in-app and all in one place
14.	Embed view: add apps and websites alongside your tasks, and declutter your screen by reducing the number of opened tabs
15.	Form view: build beautiful forms to collect information and turn them into a task in ClickUp
Each view provides a unique perspective on your work. Visualize your tasks on a List, Board, or a Calendar view and see their interconnectedness on Gantt view. To see how work is distributed among team members, simply turn to the Box view or Workload view to give help you manage your resources more effectively.
Users appreciate this level of flexibility because it allows them to manage any type of work accordingly and choose the kind of view that makes the most sense for them. 😌 🤌
2. Customization Capabilities
We can talk about this topic all day long…I mean, seriously; there are infinite ways to customize ClickUp so it might take a while to list out all the possibilities!
So instead, we’ll cover why this feature continues to capture the hearts of ClickUp’s users. 💜
No development project is the same, so why use a one-size-fits-all approach? ClickUp provides a completely customizable online software solution which means every part of the platform can be adjusted and personalized according to your workflow, personal preferences, business model, and so on!
This level of flexibility gives any type of team across industries the freedom and structure they need to make ClickUp work the way they need it to work for them!
Check out some of the customizable features that our users love using in ClickUp:
•	Custom Fields: give ClickUp tasks unlimited flexibility and let you add tons of rich information to your views
•	Custom task statuses: add different stages to your tasks to keep your team aligned and informed about a task’s progress
•	Custom Dashboards: choose from 50+ widget variations and build a dashboard for any business scenario to get a high-level reporting and overview of your work
don’t let other work tools keep you feeling stuck and trapped within their app’s limitations. 🙅‍♂️
After all, project management tools should encourage you and your to team evolve especially when you’re scaling your business. 🌱
3. Team Collaboration & Communication
It’s no secret that team collaboration and communication are key to the success of a project. Yet, it’s something that a lot of businesses struggle with, even more so now that more employees are working from home.
With ClickUp’s advanced features for team collaboration and communication, small to large teams are able to streamline all communication in one platform, collaborate with anyone in real-time, while promoting team transparency. 🧑‍💻. 🤜. 🤛 👩‍💻
Use these features in ClickUp to improve cross-departmental and client communication:
•	Single and Multiple Assignees: Assign one or multiple team members to a task to break down the amount of work and promote teamwork
•	Watchers: Add watchers to tasks to get notifications when updates are made and reduce the number of update meetings
•	Chat view: Keep your conversations with your colleagues alongside your work
•	Email in ClickUp: Send and receive emails directly from ClickUp tasks to keep all conversations in one place
•	Assigned comments and mentions: Assign a comment or action item to a specific team member, and mention (or tag) your colleagues to bring their attention to items within tasks or Chat view
•	Proofing: Assign comments directly on tasks attachments such as design mockups, legal contracts, and more
•	Docs: Use it for all kinds of use cases, including wikis, meeting notes, company portals, and of course, any type of document you can think of
•	Collaboration detection: Edit Docs with other team members in real-time and see when others are typing in a task to keep everyone on the same page (literally!)
•	Privacy and sharing: Give you complete control of who sees what, and what permissions they have
•	Whiteboards: Brainstorm and map out ideas/projects, and collaborate with your team in real-time
Whether you’re office-based or working remote, ClickUp can help you stay connected and up-to-date from anywhere, eliminating organization silos, bottlenecks, frequent update meetings, and so on!
4. Real-Time Reporting
ClickUp makes it extremely convenient to create, pull, and view reports. 📈 Reporting in ClickUp can give insight into your team’s performance; view what each team member is working on, who’s behind, and who’s ahead of their workload. It also allows you to choose from over 50 widget variations to build the custom Dashboard of your dreams. You’ll get a high-level overview of your work and have the proper reporting tools you need to track the progress of specific projects.
More ClickUp features that are helpful for reporting:
•	Workload and Box view
•	Goals
•	Milestones
•	Pulse
5. Time Tracking Capabilities
Do you need to manage your time better at work? (Don’t we all? 😬 )
Well, ClickUp can help with that! It offers flexible time tracking features to improve time management, help you focus on your work, and feel more in control of your workdays. Track time, set estimates, add notes to your tracked time, and view reports of your time from virtually anywhere with the global timer in ClickUp! ⏳ 🌎
•	Notes: add notes to your time entries to reference exactly what you spent time on
•	Labels: create and apply labels to easily categorize and filter time spent on tasks
•	Billable time: mark time as billable to see what time should be expensed on invoices
•	Sorting: sort tasks by time spent to see potential bottlenecks or where more help is needed
•	Filtering: filter time by date, statuses, priority, tags, and more
•	Rollup: see a combined total of all time spent across tasks and subtasks
•	Edit time: add or subtract time from your tracked time
•	6. Templates
•	Don’t know where to start? No worries, ClickUp’s got your back!
•	Choose from a large array of templates for all sorts of use cases. The best part about the templates is that they’re fully customizable; adjust them to your preferences and business needs. You could even create your own templates within ClickUp to save time and keep your processes consistent!
•	Take Jakub Grajcar, STX NEXT’s Marketing Manager, for example. He helped solve a team alignment issue, a common pain point that many teams experience, by creating a Marketing Sprint template in ClickUp.
•	Jakub’s Marketing Sprint Template was designed to easily visualize and identify project stages as well as create a consistent and repeatable format that would accommodate project needs moving forward.
•	Needless to say, his template has reduced turnaround time for projects, decreased the number of follow-up meetings, and empowered his team to be more productive and efficient at work!
•	We get it. Sometimes all you need is an example to get you from being stuck to totally crushing it at work! Head over to our template center and discover all the types of templates available to you—yep, for free!
•	7. Integration Power
•	While ClickUp alone is powerful enough to replace many of the other work tools you use, integrating with other apps can help you streamline your workflow in one place. In fact, ClickUp can be connected to 1000+ tools—for free! 🤯
•	Integrate ClickUp with your current work apps such as Slack, Google Calendar, Zapier, Front, and more! Connect your most used and favorite apps to ClickUp to increase work efficiency, keep processes consistent, and save time by avoiding the need to toggle between multiple apps. ClickUp’s integration power allows you to work smarter, not harder (because we already know you work hard; there’s no need to make it harder than it has to be. 😉 )
•	8. Mobile App
•	A majority of businesses use project management software for managing their projects, but the problem is that not all of them can access it on mobile devices. It can be an absolute pain when you’re working away from the office and need access to your project management tools to get work done, check for important updates, and so on.
•	Enter ClickUp’s mobile app. 👋📱✨
•	With ClickUp’s mobile app, you’ll never have that problem again!
•	The intuitive interface and easy-to-use features in ClickUp’s mobile app make it extremely useful and convenient for those who are on the go. Create new tasks, update your colleagues, and manage projects whenever, wherever!
•	9. Competitive and Affordable Pricing
•	ClickUp stands out from the crowd because of its affordable pricing plans.
•	A lot of companies offer pricing plans, but it can be difficult to find one that fits your budget and get all the features your team needs. The best part? You can start using ClickUp for free!
•	With ClickUp’s Free Forever Plan, users can explore hundreds of customizable features, add an unlimited number of seats, create an unlimited number of tasks, and more—yep, you guessed it…for free!
•	Furthermore, paid pricing plans start at only $5 per user per month which makes ClickUp an excellent choice for growing companies and solopreneurs alike. Choose your pricing plan based on what you need now or anticipate needing down the road!
•	10. World-Class 24/7 Customer Support
•	We live in a customer-centric world where customer service is king. Even though customer service has become more important than ever, many companies still struggle to provide it. While there are plenty of project management software companies out there, none of them offer the same level of customer service as ClickUp does.
•	ClickUp provides the best customer service in the industry because our customer service team does more than just help with technical issues—they also provide customer education and training so all customers can get the most out of our product.
•	Best of all, customer support is available 24/7 (including holidays), which makes a huge difference for companies who have employees working remotely or clients that need help at odd hours of the day and night. •	11. ClickUp University
•	Launched in December 2021, ClickUp University was created to help you fast-track your learning, master the ins and outs of the platform, and become a ClickUp expert. Foundational and advanced courses, on-demand videos, activities, quizzes, and pro tips are available to help you take advantage of ClickUp and customize it to fit your role and business.",ClickUp
